<?xml version="1.0" encoding="UTF-8"?>
<!-- edited with XMLSpy v2010 rel. 3 sp1 (http://www.altova.com) by XMLSpy 2011 Professional Ed. Release 3, Concurrent for 20 users (with SMP from 2011-12-05 to 2012-10-25) (Roche Diagnostics AG) -->
<!--Sample XML file generated by XMLSpy v2009 sp1 (http://www.altova.com)-->
<MainHandlerProcessFlow xmlns:xsi="http://www.w3.org/2001/XMLSchema-instance" xsi:noNamespaceSchemaLocation="mainhandler-processflow.xsd">
  <MovePatterns>
    <MovePattern PatternName="HomePosLeftToStacker">
      <ParallelMoves>
        <MoveAxis>
          <AxisName>MotorH</AxisName>
          <MoveDistance>0.0725</MoveDistance>
        </MoveAxis>
      </ParallelMoves>
      <ParallelMoves>
        <MoveAxis>
          <AxisName>MotorRG</AxisName>
          <MoveDistance>-95.9</MoveDistance>
        </MoveAxis>
      </ParallelMoves>
      <ParallelMoves>
        <MoveAxis>
          <AxisName>MotorRZ</AxisName>
          <MoveDistance>5.9</MoveDistance>
        </MoveAxis>
      </ParallelMoves>
    </MovePattern>
    <MovePattern PatternName="HomePosLeftToReagentElevator">
      <ParallelMoves>
        <MoveAxis>
          <AxisName>MotorH</AxisName>
          <MoveDistance>0.0815</MoveDistance>
        </MoveAxis>
      </ParallelMoves>
      <ParallelMoves>
        <MoveAxis>
          <AxisName>MotorRG</AxisName>
          <MoveDistance>-95.15</MoveDistance>
        </MoveAxis>
        <MoveAxis>
          <AxisName>MotorRZ</AxisName>
          <MoveDistance>5.15</MoveDistance>
        </MoveAxis>
      </ParallelMoves>
    </MovePattern>
    <MovePattern PatternName="ReferencePointStacker">
      <ParallelMoves>
        <MoveAxis>
          <AxisName>MotorH</AxisName>
          <MoveDistance>0.0815</MoveDistance>
        </MoveAxis>
      </ParallelMoves>
      <ParallelMoves>
        <MoveAxis>
          <AxisName>MotorRG</AxisName>
          <MoveDistance>-95.65</MoveDistance>
        </MoveAxis>
      </ParallelMoves>
      <ParallelMoves>
        <MoveAxis>
          <AxisName>MotorRZ</AxisName>
          <MoveDistance>5.65</MoveDistance>
        </MoveAxis>
      </ParallelMoves>
      <ParallelMoves>
        <MoveAxis>
          <AxisName>MotorX</AxisName>
          <MoveDistance>-0.01529</MoveDistance>
        </MoveAxis>
      </ParallelMoves>
    </MovePattern>
    <MovePattern PatternName="ReferencePointPCStacker">
      <ParallelMoves>
        <MoveAxis>
          <AxisName>MotorH</AxisName>
          <MoveDistance>0.0815</MoveDistance>
        </MoveAxis>
      </ParallelMoves>
      <ParallelMoves>
        <MoveAxis>
          <AxisName>MotorRG</AxisName>
          <MoveDistance>-97.67</MoveDistance>
        </MoveAxis>
      </ParallelMoves>
      <ParallelMoves>
        <MoveAxis>
          <AxisName>MotorRZ</AxisName>
          <MoveDistance>7.67</MoveDistance>
        </MoveAxis>
      </ParallelMoves>
    </MovePattern>
    <MovePattern PatternName="ReferencePointReagentElevator">
      <ParallelMoves>
        <MoveAxis>
          <AxisName>MotorH</AxisName>
          <MoveDistance>0.0815</MoveDistance>
        </MoveAxis>
      </ParallelMoves>
      <ParallelMoves>
        <MoveAxis>
          <AxisName>MotorRG</AxisName>
          <MoveDistance>-106.79</MoveDistance>
        </MoveAxis>
        <MoveAxis>
          <AxisName>MotorRZ</AxisName>
          <MoveDistance>16.79</MoveDistance>
        </MoveAxis>
      </ParallelMoves>
      <ParallelMoves>
        <MoveAxis>
          <AxisName>MotorX</AxisName>
          <MoveDistance>-0.008819</MoveDistance>
        </MoveAxis>
      </ParallelMoves>
    </MovePattern>
    <MovePattern PatternName="HomePosLeftToHandover">
      <ParallelMoves>
        <MoveAxis>
          <AxisName>MotorRZ</AxisName>
          <MoveDistance>-90</MoveDistance>
        </MoveAxis>
      </ParallelMoves>
      <ParallelMoves>
        <MoveAxis>
          <AxisName>MotorH</AxisName>
          <MoveDistance>0.046</MoveDistance>
        </MoveAxis>
        <MoveAxis>
          <AxisName>MotorX</AxisName>
          <MoveDistance>0.0224</MoveDistance>
        </MoveAxis>
      </ParallelMoves>
    </MovePattern>
    <MovePattern PatternName="HomePosLeftToProcessCellHandover">
      <ParallelMoves>
        <MoveAxis>
          <AxisName>MotorRZ</AxisName>
          <MoveDistance>-90</MoveDistance>
        </MoveAxis>
      </ParallelMoves>
      <ParallelMoves>
        <MoveAxis>
          <AxisName>MotorH</AxisName>
          <MoveDistance>0.074</MoveDistance>
        </MoveAxis>
        <MoveAxis>
          <AxisName>MotorX</AxisName>
          <MoveDistance>0.0224</MoveDistance>
        </MoveAxis>
      </ParallelMoves>
    </MovePattern>
    <MovePattern PatternName="HomePosLeftToProcessCellHandoverADPlate">
      <ParallelMoves>
        <MoveAxis>
          <AxisName>MotorRG</AxisName>
          <MoveDistance>-180</MoveDistance>
        </MoveAxis>
      </ParallelMoves>
      <ParallelMoves>
        <MoveAxis>
          <AxisName>MotorRZ</AxisName>
          <MoveDistance>-90</MoveDistance>
        </MoveAxis>
      </ParallelMoves>
      <ParallelMoves>
        <MoveAxis>
          <AxisName>MotorH</AxisName>
          <MoveDistance>0.074</MoveDistance>
        </MoveAxis>
        <MoveAxis>
          <AxisName>MotorX</AxisName>
          <MoveDistance>-0.0224</MoveDistance>
        </MoveAxis>
      </ParallelMoves>
    </MovePattern>
    <MovePattern PatternName="ReferencePointHandoverSC">
      <ParallelMoves>
        <MoveAxis>
          <AxisName>MotorRZ</AxisName>
          <MoveDistance>-90</MoveDistance>
        </MoveAxis>
      </ParallelMoves>
      <ParallelMoves>
        <MoveAxis>
          <AxisName>MotorH</AxisName>
          <MoveDistance>0.041</MoveDistance>
        </MoveAxis>
      </ParallelMoves>
    </MovePattern>
    <MovePattern PatternName="ReferencePointHandoverPC">
      <ParallelMoves>
        <MoveAxis>
          <AxisName>MotorRZ</AxisName>
          <MoveDistance>-90</MoveDistance>
        </MoveAxis>
      </ParallelMoves>
      <ParallelMoves>
        <MoveAxis>
          <AxisName>MotorH</AxisName>
          <MoveDistance>0.07</MoveDistance>
        </MoveAxis>
      </ParallelMoves>
    </MovePattern>
    <MovePattern PatternName="HomePosLeftToHomePosRight">
      <ParallelMoves>
        <MoveAxis>
          <AxisName>MotorRG</AxisName>
          <MoveDistance>-270</MoveDistance>
        </MoveAxis>
      </ParallelMoves>
      <ParallelMoves>
        <MoveAxis>
          <AxisName>MotorH</AxisName>
          <MoveDistance>-0.0445</MoveDistance>
        </MoveAxis>
      </ParallelMoves>
      <ParallelMoves>
        <MoveAxis>
          <AxisName>MotorRZ</AxisName>
          <MoveDistance>172.33</MoveDistance>
        </MoveAxis>
      </ParallelMoves>
    </MovePattern>
    <MovePattern PatternName="HomePosRightToADStacker">
      <ParallelMoves>
        <MoveAxis>
          <AxisName>MotorH</AxisName>
          <MoveDistance>0.126</MoveDistance>
        </MoveAxis>
      </ParallelMoves>
      <ParallelMoves>
        <MoveAxis>
          <AxisName>MotorRG</AxisName>
          <MoveDistance>187.67</MoveDistance>
        </MoveAxis>
      </ParallelMoves>
    </MovePattern>
    <MovePattern PatternName="ReferencePointPCStackerAD">
      <ParallelMoves>
        <MoveAxis>
          <AxisName>MotorH</AxisName>
          <MoveDistance>0.126</MoveDistance>
        </MoveAxis>
      </ParallelMoves>
      <ParallelMoves>
        <MoveAxis>
          <AxisName>MotorRG</AxisName>
          <MoveDistance>195.48</MoveDistance>
        </MoveAxis>
      </ParallelMoves>
      <ParallelMoves>
        <MoveAxis>
          <AxisName>MotorRZ</AxisName>
          <MoveDistance>-7.81</MoveDistance>
        </MoveAxis>
      </ParallelMoves>
    </MovePattern>
    <MovePattern PatternName="HomePosRightToADTransferPosition">
      <ParallelMoves>
        <MoveAxis>
          <AxisName>MotorH</AxisName>
          <MoveDistance>0.066</MoveDistance>
        </MoveAxis>
      </ParallelMoves>
      <ParallelMoves>
        <MoveAxis>
          <AxisName>MotorRZ</AxisName>
          <MoveDistance>2.02</MoveDistance>
        </MoveAxis>
        <MoveAxis>
          <AxisName>MotorRG</AxisName>
          <MoveDistance>185.65</MoveDistance>
        </MoveAxis>
      </ParallelMoves>
      <ParallelMoves>
        <MoveAxis>
          <AxisName>MotorH</AxisName>
          <MoveDistance>0.060</MoveDistance>
        </MoveAxis>
      </ParallelMoves>
    </MovePattern>
    <MovePattern PatternName="ReferencePointADTransferPosition">
      <ParallelMoves>
        <MoveAxis>
          <AxisName>MotorH</AxisName>
          <MoveDistance>0.126</MoveDistance>
        </MoveAxis>
      </ParallelMoves>
      <ParallelMoves>
        <MoveAxis>
          <AxisName>MotorRZ</AxisName>
          <MoveDistance>-5.74</MoveDistance>
        </MoveAxis>
        <MoveAxis>
          <AxisName>MotorRG</AxisName>
          <MoveDistance>193.41</MoveDistance>
        </MoveAxis>
      </ParallelMoves>
      <ParallelMoves>
        <MoveAxis>
          <AxisName>MotorX</AxisName>
          <MoveDistance>-0.05588</MoveDistance>
        </MoveAxis>
      </ParallelMoves>
    </MovePattern>
    <MovePattern PatternName="HandoverRotationDefaultToADPlate">
      <ParallelMoves>
        <MoveAxis>
          <AxisName>MotorRG</AxisName>
          <MoveDistance>-180</MoveDistance>
        </MoveAxis>
      </ParallelMoves>
      <ParallelMoves>
        <MoveAxis>
          <AxisName>MotorX</AxisName>
          <MoveDistance>-0.045</MoveDistance>
        </MoveAxis>
      </ParallelMoves>
    </MovePattern>
  </MovePatterns>
  <LogProcessFlowPositions>
    <LogProcessFlowPosition ParkPos="Left">
      <ModuleDefinition>
        <!-- PC1HandoverStation -->
        <Module>
          <ModuleID>63</ModuleID>
        </Module>
      </ModuleDefinition>
      <ModuleDefinition>
        <!-- PC2HandoverStation -->
        <Module>
          <ModuleID>86</ModuleID>